管理No,テーマ,タイトル,フック,解決策,エンド,ネタメモ,カテゴリ,元No
34,人時売上高,人時売上高,人時売上高は、高ければいい数字じゃありません,"人時売上高は、この式で出します。
人時売上高 ＝ 売上 ÷（労働時間の合計）","人時売上高を見ていない店は、儲かっているつもりで、静かに閉業に向かってる場合もあります
高すぎるのは未来を削って今を作っているだけ、低すぎるのは忙しいだけで利益が残らないです
健全に上がった人時売上高だけが正解です",人時売上高,今伸びてるもの,10
35,事務作業やってたらライバル店に置いていかれる,事務作業やってたらライバル店に置いていかれる,売上を伸ばしているお店ほど、現場のパソコン業務をしてません,"飲食店経営は「現場と判断」に集中した店が勝ちます
利益を直接生まない業務は、全部外注にしています","事務作業を「自分でやるか・やらないか」は、コストの話じゃなくて経営スピードの話です
もし今
・事務に追われて現場が見れていない
・数字はあるのに判断が遅れる
・社長が一番忙しい
このどれかに当てはまるなら、僕が提供している飲食店専門のバックオフィスサービスを低額でお受けできますのでいつでもご相談ください",事務作業やってたらライバル店に置いていかれる,新テーマ,11
36,税理士さんから去年の決算書そろそろ届きました？,税理士さんから去年の決算書そろそろ届きました？,税理士さんから決算書が届いても売上だけ見てたら経営者失格です,"最低限、この3つだけ見る癖をつけてください
・営業利益は増えたか、減ったか
・人件費率・原価率は去年と比べてどうか
・現金は増えているか、減っているか","決算書を読まない人に経営が上手くなる未来はありません
決算書は難しい書類ではなく経営の通知表です
去年と今年の決算書を並べて、数字が増えたか減ったかに○×をつけるだけでも理解が深まりますよ",税理士さんから去年の決算書そろそろ届きました？,トリガー,12
37,厳しい話ですが、アルバイトはお金目的です,厳しい話ですが、アルバイトはお金目的です,厳しい話ですが、アルバイトはお金目的で働きに来てます,お金は動機ではなく前提条件であってマネジメントで多くのお店が失敗する理由はお金（衛生要因）とやりがい（満足要因）を混同しているからです,"まずは衛生要因を満たしたあと判断基準を明確にし、裁量を渡し承認をしてあげてください
明日アルバイトにこう聞いてみてください。
「この店で、何を頑張れば評価されると思う？」
この質問にアルバイトが即答できないのであれば危険信号です",厳しい話ですが、アルバイトはお金目的です,過去に伸びたもの,1
38,交差原価,交差原価,あなたのお店のメニュー、お客様から「つまらん」って思われる構成になってるかもですよ,"交差原価とはメニュー全体の平均原価で判断する考え方
交差原価＝ 単品原価率 × 売上構成比で各商品の交差原価が計算できます",原価高いから値上げ・削除と早まるのではなく集客用メニュー、利益残すようメニューと使い分けられるようになりましょう,交差原価,過去に伸びたもの,2
39,計画しなさすぎ（PL）→コメントで無料面談,計画しなさすぎ（PL）→コメントで無料面談,これから飲食店を始めるのにPLを一切考えてない人、多すぎます,"飲食は勢いで始められるけど、計画なしでは生き残れないビジネスです
飲食店は、開業前にPLが描けていない時点で負けです。
・月商はいくらを狙うのか
・原価と人件費は何％にするのか
・家賃と固定費はいくらか
・最終的に、いくら残したいのか
ここからさらに
・席数
・単価
・営業時間
・人員配置
全部が逆算で決まります","もしあなたが
・これから飲食店を始める
・今まさに計画段階にいる
このどちらかなら、今が一番、軌道修正しやすいタイミングです。
今回は「これから開業」または「計画段階」の方のみ限定で、 PL計画の無料面談をやります
面談お願いしたい方はコメントください",計画しなさすぎ（PL）→コメントで無料面談,過去に伸びたもの,3
40,365日なにがあっても上げ続けられますか？（ショート動画）,365日なにがあっても上げ続けられますか？（ショート動画）,365日、何があっても上げ続けられないなら、SNS集客はやらない方がマシです,"「時間がある時にでも」
「投稿ネタが浮かんだら」
「週一投稿は頑張る」
このスタンスで集客に成功したお店はありません
SNS集客は、センスじゃなく継続できるかどうかの勝負です","・完璧を狙わない
・毎回バズらせようとしない
・反応より“投稿回数”を最優先する
SNSは1本の神投稿より、100本の普通の投稿が効きます",365日なにがあっても上げ続けられますか？（ショート動画）,過去に伸びたもの,4
41,社長の仕事は意思決定,社長の仕事は意思決定,"社長の仕事は現場ではなく意思決定です
頑張っているのに伸びひんのは努力不足じゃなくて役割を取り違えているだけです","社長がやるべき仕事は「判断」と「優先順位付け」だけ
一瞬の判断の遅れはキャッシュフローが早い飲食では致命傷です","現場を回す社長は、会社を止めます
社長が現場にいる時間が長いほど、会社は今の現状から抜け出せません
明日から
・何に投資するか
・何をやめるか
・誰に任せるか
3つを決めて仕事をしてください",社長の仕事は意思決定,今伸びてるもの,5
42,ペルソナが決まってなかったら開業時に大失敗します（メニュー開発、写真、皿などのコスト）,ペルソナが決まってなかったら開業時に大失敗します（メニュー開発、写真、皿などのコスト）,ペルソナが決まっていないまま開業すると、200万円は損します,"ペルソナはマーケの話だけじゃなくてコスト管理の話です
ペルソナが曖昧やと
・メニューが増える
・写真を撮り直す
・皿を買い替える
逆に、ペルソナが決まっていれば
・売る品数が絞れる
・必要な写真が決まる
・皿の数・サイズ・素材が決まる
つまり、先に誰を決めるだけで、開業コストは落ちるんです","計画しない開業は、必ず高くつきます。
「この店は、誰のどんなシーンを取りに行くのか」
これがまだ分からないなら計画は甘いです",ペルソナが決まってなかったら開業時に大失敗します（メニュー開発、写真、皿などのコスト）,今伸びてるもの,6
43,取引業者や営業に対して高圧的な態度取ってる経営者は会社の成長止めてますよ,取引業者や営業に対して高圧的な態度取ってる経営者は会社の成長止めてますよ,取引業者や営業に高圧的な経営者は情報と選択肢を失いますよ,"外部への態度は、そのまま社内マネジメントの写し鏡です
業者に対して横柄・一方的・敬意がない
この姿勢は、必ず社内に伝播します
「立場が上なら、雑に扱っていい」とスタッフは勘違いしますよ","マネジメントは、社内だけの話じゃありません。
外部への敬意は、会社の文化になります
「この態度を、社員は見てどう思うか？」これを一度だけ意識してください。",取引業者や営業に対して高圧的な態度取ってる経営者は会社の成長止めてますよ,今伸びてるもの,7
44,守り攻めのマインド　リスク志向（RQ）,守り攻めのマインド　リスク志向（RQ）,組織が伸びない最大の原因は全員に同じリスク判断を求めていることです,"マネジメントは「能力を伸ばすと思ってたら勘違いで、リスクの取り方を設計する仕事です
人によってリスク許容度は異なります",守り型、攻め型のバランスを取りながらチームを構成し、個々人に合わせたマネジメントをしてください,守り攻めのマインド　リスク志向（RQ）,今伸びてるもの,8
45,自分は料理できひんしって経営者さん、それでいいんです,自分は料理できひんしって経営者さん、それでいいんです,自分は料理できひんしって経営者さん、それでいいんです,"社長が現場で一番うまくやる必要はありません
「自分がやった方が早い」は一番高いコストです
社長の仕事は包丁を握ることではなく意思決定です","社長が現場を回すほど、会社は前に進みません
明日の予定を見て、作業か意思決定か仕分けしてください
料理ができなくてもいいので決められる社長でいてください",自分は料理できひんしって経営者さん、それでいいんです,今伸びてるもの,9
46,お店を始める時にデザイナーは絶対入れろ,お店を始める時にデザイナーは絶対入れろ,お店を始める時に空間デザイナーを入れへんお店は確実に高くつきます,"DIYでええわって初期費用を下げたつもりで将来コストを爆増させます
内装で一番高くつくのはやり直しです
・動線が悪くてオペが詰まる
・席配置を変えたくなって壁を壊す
・照明や色が合わず撮影し直す
・コンセプトが曖昧で客層がズレる
これ、全部開業後に気づくから高いんです","内装は「安く作る」ものじゃない
「動線を考えた上で作る」ものです
半年後も同じ形で使えてるか？を想像してください
ここはケチらずしっかりプロを入れましょう",お店を始める時にデザイナーは絶対入れろ,今伸びてるもの,10
47,月次決算は出せ,月次決算は出せ,月次決算出してへん経営は上手く行くはずがないんです,"決算書だけ見て年１で見てるってそれ手遅れになってから原因を探しているだけですよ
コストは月次でしか制御できません
ズレを小さいうちに潰すため月次決算を出してください","先月分の「売上・原価・人件費」この3つを、1枚にまとめてください
細かい勘定科目はいらないのでまずは毎月、同じ数字を見る癖をつけましょう",月次決算は出せ,新テーマ,11
48,ID、PASS管理してますか？,ID、PASS管理してますか？,IDとパスワードを管理していない店は、いつ営業停止してもおかしくありません,"ID／PASS管理は“ITの話”ではなく経営リスク管理の話です
今の飲食店は、ITに握られて経営しているからです
グルメ媒体、SNS、予約、決済、どれか一つ失った瞬間お店は簡単に止まります","グルメ媒体・SNS・予約・決済、ログインできるかを今すぐ全部確認してください
ITは便利ですが、放置すると一番怖い
管理は、経営の基本です
・全媒体のID／PASSを一覧化
・管理者を1人決める
・引き継ぎルールを作る
これらを決めて運用しましょう",ID、PASS管理してますか？,トリガー,12
49,悩みがつきない経営者→公式ライン追加で情報提供をしています,悩みがつきない経営者→公式ライン追加で情報提供をしています,飲食店経営をしていて、悩みが一切ない人なんていません,"・数字のこと
・人のこと
・集客のこと
・将来のこと
一人で考え続けて正解が分からなくなっている経営者さん、ほんまに多いです。","経営の悩みは、一人で抱えるほどこじれます
でも悩みがあるのは、ちゃんと経営している証拠です。
もし今、誰にも相談できていないのであれば僕のプロフィールから公式ライン追加してみてください
飲食店経営に使える有益な情報も流していますよ",悩みがつきない経営者→公式ライン追加で情報提供をしています,過去に伸びたもの,1
50,SNSやらんくていいお店,SNSやらんくていいお店,SNSをやらなくていいお店もあるんです,"一等地の家賃は毎月払う広告費です
人通り・視認性・偶然の来店、これをお金で買っている状態です
一方で二等地・裏通り・住宅街・郊外ここはSNS必須です
人通りがない代わりに、マーケで来店理由を作らないと成立しないです",家賃を払って立地集客を取るかマーケ費用を払って理由集客を取るかのどちらかです,SNSやらんくていいお店,過去に伸びたもの,2
51,原価計算めんどい,原価計算めんどい,正直原価計算、面倒ですよね,"でも、「めんどいからやらん」を続けているお店ほど、気づかんうちに利益を削っています
原価計算を後回しにする店は、一生なんで儲からないかが分かりません","なので今回は、原価計算と連動したレシピシートを配布します
レシピをメモってるだけで原価計算がほぼできるのでぜひ欲しい方はコメントください",原価計算めんどい,過去に伸びたもの,3
52,既製品を正しく味方につけろ,既製品を正しく味方につけろ,既製品＝プロじゃない、この考えが原価と人件費を無駄に押し上げています,"既製品は代替じゃなくて工程を買うという選択です
既製品を使うと
・原価が安定する（ブレない）
・人件費が下がる（仕込み・教育が減る）
・品質が揃う（属人化しない）
しかも今の既製品は、ベースだけ既製で仕上げは店でというハイブリッド運用が前提で作られているも増えました","これからは賢く既製品を使える料理人が必要とされています
既製品を利益を守るための戦略として取り入れてみませんか？",既製品を正しく味方につけろ,過去に伸びたもの,4
53,面接のやり方,面接のやり方,面接は能力採用ではなく人格採用をするべきです,"採用はゴールではなく、マネジメントの入口です
面接を期待値すり合わせの場にできるのが優秀な面接官です
特に面接で見るのはこの3点です
Will：やりたいこと
Can：できること
Must：求められること
特に重要なのはWillとMustの重なり。
「本人がやりたい方向」と「会社が求める役割」が重なっていない人はいずれ辞めます","「このお店での仕事で、どんな時にやりがいを感じると思いますか？」
面接時にこの一言を必ず聞くようにすると判断しやすいですよ",面接のやり方,今伸びてるもの,5
54,脳のリソース,脳のリソース,今の時代の飲食店経営者に足りていないのは考える余白です,"経営者の価値は「判断の質」です
情報飽和社会では
・事務
・連絡
・確認
・微調整
こういったタスクが脳内リソースを静かに食い尽くします
その結果、決断が先延ばしになる、優先順位がブレる、本来やるべき判断を見落とすといった弊害が生まれます","これを防ぐ方法は外注とDXです
考えなくていいことを脳から追い出すだけ
任せるのは仕事じゃなくて思考負荷です
脳のリソースが空いた時経営は一段上に進みます",脳のリソース,今伸びてるもの,6
55,節税は貧乏の入り口,節税は貧乏の入り口,節税は、やり方を間違えると貧乏の入り口です,"税金は減ったけど会社も弱くなっているというのがよくある失敗です
ダメな節税の典型はこれです
・必要ない支出を増やす
・今いらないものを買う
・利益を消すためだけの経費
本当にやるべきは逆で
・利益を出す
・キャッシュを厚くする
・投資できる状態を作る
その上で残った利益をどう扱うかを考えましょう","節税が先に来る経営は必ず判断が歪みます
税金を嫌って利益を嫌う経営は長くは続きません
稼ぐ力を強くする方を優先しましょう",節税は貧乏の入り口,今伸びてるもの,7
56,昔はきつかった武勇伝もうやめません？令和ですよ？,昔はきつかった武勇伝もうやめません？令和ですよ？,昔はきつかった武勇伝もうやめません？令和ですよ？,"「俺たちが若い頃はもっと大変やった」の一言で、人は静かに離れます
根性論と長時間労働は、育成でも文化でもない時代遅れのマネジメントです
厳しさは必要ですが、暴力や無駄な拘束は要らないです","武勇伝は、組織を強くしません
時代に合ったやり方を選べる組織だけが人も成果も残します",昔はきつかった武勇伝もうやめません？令和ですよ？,今伸びてるもの,8
57,休憩どこで取ってるかでお店の繁盛具合が分かります,休憩どこで取ってるかでお店の繁盛具合が分かります,どこで休憩を取っているかで、その店の繁盛度は分かります,"客席で休憩を取ると自然にお客様が見てる風景が見えてきます
照明で顔めっちゃ暗く見えるやん、BGMめちゃくちゃでかくない？、ここの机ガタついてるな
これ現場で営業中には見えません","休憩を客席で取るのは一番安いマーケティング調査です
客席で過ごした時間の分だけお店は良くなります
裏や毎回同じ席でしか休憩を取らないお店ほど、お客様の視界からズレていきます",休憩どこで取ってるかでお店の繁盛具合が分かります,今伸びてるもの,9
58,バックオフィスはDX化、キッチン内の管理は紙,バックオフィスはDX化、キッチン内の管理は紙,コンサルに言われてタスク管理DX化したら現場崩壊しますよ,"事務周りはDX化、キッチン内の管理は紙が鉄則です
全部デジタル管理でやっているお店ほど、タスクが漏れて、ミスが増えます
現場に合わない管理は、管理になりません","タスク管理は「考える場所」と「動く場所」で分けること
事務周りは履歴・検索・共有が命です
現場は手が汚れるわ、一瞬で見たいし、迷ったら即確認できるので紙のチェックリストが一番適してます
「タブレット開く時間」「ログインする手間」これ全部ミスとストレスの原因です
考える仕事はDXへ。動く仕事は紙へ。これだけは守ってください",バックオフィスはDX化、キッチン内の管理は紙,今伸びてるもの,10
59,小口会計が多い店舗,小口会計が多い店舗,小口会計は例外対応にすべきで、日常運用にした瞬間から害になります,"横領リスクが一気に上がる
会計処理の工数が爆増する
人件費が無駄に膨らむ
原価管理がズレる
仕入れ基準が属人化する
在庫が増える・腐る・消える
経営者が状況を把握できない
百害あって一理なしです","小口は緊急時のみの対応にし、上限額をしっかりと決めて運用しましょう
買い出しは0にして業者仕入れを中心に切り替えましょう",小口会計が多い店舗,新テーマ,11
60,生産者に会いに行け,生産者に会いに行け,生産者に会いに行かない飲食人はどこかで代替されますよ,"生産者に会いに行く理由は物語を背負うためです
畑を見る。海を見る。人の顔を見る。
そこで分かるのは、
・なぜこの食材がこの価格なのか
・どんな苦労と選択の上にあるのか
・どこを一番大事にして作っているのか
これを知った瞬間、
スタッフが食材を無駄にしなくなるし扱いが丁寧になる
サービスマンは伝え方が変わります
結果料理に説得力が宿るんです","飲食人の仕事は、「作る」だけじゃありません。
「伝える」仕事です。",生産者に会いに行け,トリガー,12
61,契約書をちゃんと読まないとダメ,契約書をちゃんと読まないとダメ,契約書を読まないのは経営判断を放棄しているのと同じです,"まずは解約条件・責任の所在・期間と更新の3点だけ線を引いてください
全部読めなくていいので不利になるポイントだけは逃さないようにしましょう",契約は作業にせずに経営リテラシーと思って取り組んでください,契約書をちゃんと読まないとダメ,過去に伸びたもの,1
62,バックオフィスを作るなら絶対に経理から,バックオフィスを作るなら絶対に経理から,バックオフィスを作るなら絶対に経理からです,"人事でも、総務でも、広報でもないです
経理を後回しにする会社ほど判断が遅く、成長が鈍ります
理由は簡単で経営は数字でしか前に進まないからです","経理は意思決定を可能にする部署です
経理が整うと
・月次で利益が見える
・原価と人件費のズレに気づける
・投資していいか、止めるべきか判断できる
組織が大きくなるほど社長の勘は通用しなくなるので数字で決められる仕組作りをしていきましょう",バックオフィスを作るなら絶対に経理から,過去に伸びたもの,2
63,補助金に頼ってたら銀行からお金借りにくくなりますよ,補助金に頼ってたら銀行からお金借りにくくなりますよ,補助金頼りの経営は使い方を間違えると一気に首を絞めます,"補助金をCFの「主役」にした瞬間、経営を歪めます
補助金頼りになると、必ず起きるのがこの3つ
・投資判断が甘くなる。
「必要だから」じゃなく
「補助金が出るから」で決め始めてしまう
・利益幅が削られる
補助金は初期費用だけ
運用・保守・人件費はずっと残る
・銀行から警戒される
「この会社、補助金がないと回らないのでは？」
そう見られた瞬間、融資は一気に慎重になります","ROIが曖昧なまま固定費だけ増やしてると月次で見るとじわじわ利益が薄くなってますよ
補助金がなくても黒字、もしくは投資の回収が数字で説明できる場合のみ使っていいブースト機能に過ぎません",補助金に頼ってたら銀行からお金借りにくくなりますよ,過去に伸びたもの,3
64,一回に食べれる総量300g〜500g,一回に食べれる総量300g〜500g,人が一回の食事で美味しく・無理なく食べられる量は300g〜500g前後です,"次を頼ませる余白を残さないと、満腹にさせてはしまっては客単価を自分で下げる行為です
量を減らすという考えではなく客単価と一皿あたりのg数をコントロールしてください","オーダー点数が増えて結果的に客単価は上がります
・「もう一品いける」
・「次は何にしよう」
が自然に生まれるとオーダー点数が増えて、結果的に客単価は上がります
次の一皿への導線を作るためにまずは人間の満腹になる量を把握しておきましょう",一回に食べれる総量300g〜500g,過去に伸びたもの,4
65,ABC分析による利益改善方法,ABC分析による利益改善方法,ABC分析を使いこなせてない店舗があまりにも多すぎる,"ABC分析を見てメニュー表に反映できていない時点で利益改善は起きません
原価パフォーマンスが良いものを意図的にA商品に持ち上げられて飲食店経営です","メニューは一覧表ではなく営業ツールです
数字で分けて見せ方で誘導する
それがABC分析による利益改善です",ABC分析による利益改善方法,今伸びてるもの,5
