管理No,テーマ,タイトル,フック,解決策,エンド,ネタメモ,カテゴリ,元No
66,どうやったら相談できますか？→無料面談,どうやったら相談できますか？→無料面談,「どうやったら相談できますか？」って聞かれるんですが,"相談は、DM一本で大丈夫です
一時間みっちり相談に乗ります
特別な準備も上手く話す必要もありません
状況をそのまま話してもらえればOKです","悩みを言語化できた時点で経営は一歩前に進みます
もし今
・誰かに一度話して整理したい
・判断が合っているか確認したい
・一人で考えるのがしんどい
そう思っているならDMで「無料面談」と送ってください。",どうやったら相談できますか？→無料面談,今伸びてるもの,6
67,正直に言うと、 今の経営の仕方なら“この先も楽にはならない”可能性は高い,正直に言うと、 今の経営の仕方なら“この先も楽にはならない”可能性は高い,正直に言うと今の経営の仕方ならこの先も楽にはならない可能性は高いです,"・自分が動かないと回らない
・判断が全部自分に集まる
・忙しいのに、未来が見えん
経営のやり方が一個前のフェーズのままなだけです
そのままやと、今の延長線上に「楽になる未来」はないですよ","この漠然とした不安はあなたがサボっているからじゃありません
むしろ逆でちゃんと経営しているから
違和感に気づいている証拠です
少しの意識でいいので
・数字を感覚から切り離す
・判断を仕組みに落とす
・自分しかできない仕事を減らす
というところから始めてみてはいかがですか？","正直に言うと、
今の経営の仕方なら“この先も楽にはならない”可能性は高い",今伸びてるもの,7
68,賄い,賄い,賄い無料にしてたら税務調査で追加徴税を食らう可能性普通にありますよ,"賄いが無料やと現物給与、要は給料の一部と見なされやすいです
・従業員が食事価額の50％以上を負担していること
・会社負担分が、1か月あたり3,500円（税抜）以下であること
このどちらかを外すと、差額は現物給与となり課税対象になります。",リスクを負いたくないのであれば明日担当の税理士さんに確認してみてくださいね,賄い,今伸びてるもの,8
69,労基法違反,労基法違反,飲食店、休憩の与え方で労基法違反しているケースがかなり多いです,"お客様や業者さんが来たらすぐ対応する休憩
休憩中も電話・指示待ち
分割しすぎの細切れ休憩
これら全てアウトです
労働基準法 労基法が定める「休憩」の正確なポイントは3つです
① 休憩は「途中」に与える
→ シフト前後にまとめて付けるのは原則NG
② 一斉に与える
→ ただ飲食は「一斉付与の例外業種」なのでOK
③ 自由利用であること（最重要）
→ 業務から完全に解放されていること
飲食店が違反になるのは、ほぼ③です。","違反が発覚したら何が起きるかというと
・労基署是正勧告
・過去分の未払い賃金請求
・悪質やと書類送検
特に最近は、退職者の通報が一番多い。
「忙しかっただけ」は一切考慮されません
休憩は法律で守られた労働条件です",労基法違反,今伸びてるもの,9
70,Googleの口コミ→ガイドライン違反,Googleの口コミ→ガイドライン違反,知らずにGoogle口コミを集めてるとアカウント停止になりますよ,"口コミ投稿を条件に割引、商品サービス、ポイント付与、★5でお願いしますなどは全てGoogleガイドライン違反です
また「口コミ書いてくれたら◯◯円引き」は景品表示法違反の可能性が高いです
これ、「少額だからOK」とか「みんなやってるからOK」は一切通用しません","口コミはマーケ施策の前に信用情報です
短期で増やそうとすると必ず間違った運用になりかねないです
お店の中身を磨いて書きたくなる状態を作って、積み上げていきましょう",Googleの口コミ→ガイドライン違反,今伸びてるもの,10
71,この数字を見ずに決める出店は、ほぼ事故です,この数字を見ずに決める出店は、ほぼ事故です,この数字を見ずに決める出店は、ほぼ事故です,"固定費をちゃんと見ずに決める出店は経営じゃなくてギャンブルです
「売上はいけそう」「立地は悪くない」この判断が事故の始まりです
固定費は努力で下げられない数字です
固定費が高いと損益分岐点売上も高くなります",売上が2〜3割落ちても、この固定費、耐えられるか？を何度も計算してから始めてください,この数字を見ずに決める出店は、ほぼ事故です,新テーマ,11
72,食品消費税ゼロが飲食店にもたらす影響→PEST分析,食品消費税ゼロが飲食店にもたらす影響→PEST分析,食品消費税ゼロがどうこう嘆いてた飲食店の経営は1ミリも良くなりません,"食品消費税がゼロになる、ならない、一部だけ変わる
正直どれでも良かったんです
政治的要因で嘆くのではなく定数として扱うものです
賢い経営者は自分では変えられないという事実を理解し変わったら、どう動くかしか考えてないです","政治を嘆く時間は経営にとって一番生産性が低い時間です
政治は環境。経営は行動。
環境に文句を言うお店と、環境に合わせて動くお店
結果が出るのは、いつも後者です",食品消費税ゼロが飲食店にもたらす影響→PEST分析,トリガー,12
