管理No,テーマ,タイトル,フック,解決策,エンド,ネタメモ,カテゴリ,元No
1,肉の仕入れ見て、なかったことにしたいって思う日何回もありますよね（焼肉）,肉の仕入れ見て、なかったことにしたいって思う日何回もありますよね（焼肉）,肉の仕入れ見て、なかったことにしたいって思う日正直何回もありますよね,"相場変動が激しい
高原料食材が主役
歩留計算をせずにロスが見えにくい",高原価肉（タン、ハラミなど）×低原価肉（ホルモン系）をセットで売りましょう,肉の仕入れ見て、なかったことにしたいって思う日何回もありますよね（焼肉）,過去に伸びたもの,1
2,1号店は順調、2号店だけ数字が出ない,1号店は順調、2号店だけ数字が出ない,1号店の成功要因を構造化できていないお店は2号店失敗します,"1号店の成功要因を「再現可能／不可」に分けて
2号店では再現可能な要素のみで成立する前提を再設計してください","2号店問題は、現場や努力の問題ではなく、１号店の成功をどう理解しているかの問題です
同じ店を作った＝同じ成果が出ると思っていると必ず閉店します",1号店は順調、2号店だけ数字が出ない,過去に伸びたもの,2
3,売上報告は出すが、決定権はない,売上報告は出すが、決定権はない,多店舗フェーズで、店舗管理者に売上報告は出させるが、決定権はない状態だと広げきれないですよ,権限と責任は必ずセットで渡すこと、権限は「一気に」渡さないで段階で渡すこと、判断基準は人に任せずルールで渡すこと、これを守ってから権限委譲して行きましょう,"多店舗経営は、社長が優秀でも回らないです
判断が分散され、それでもブレない設計がある時だけ回ります",売上報告は出すが、決定権はない,過去に伸びたもの,3
4,めちゃくちゃ忙しい時間帯に限ってビール樽交換…でもアルバイトはできひんしって経験ないですか？,めちゃくちゃ忙しい時間帯に限ってビール樽交換…でもアルバイトはできひんしって経験ないですか？,めちゃくちゃ忙しい時間帯に限ってビール樽交換…でもアルバイトはできひんしって経験ないですか？,"判断力で指揮を取っている人が、一番単純な作業に縛られることが危険な状態ということに早く気づいてください
忙しい時に発生する作業は忙しい時に一番手が空いている人ができるようにしておくことです",暇な時に全員が一度は経験して教えていない・任せれないを無くして、判断がいらない作業まで、店長・社員がやらなくて済む準備をしましょう,めちゃくちゃ忙しい時間帯に限ってビール樽交換…でもアルバイトはできひんしって経験ないですか？,過去に伸びたもの,4
5,新店舗、どこもかしこも〇〇牛みたいなブランド牛で戦ってもう差別化が難しいんですよね,新店舗、どこもかしこも〇〇牛みたいなブランド牛で戦ってもう差別化が難しいんですよね,焼肉屋さん、どこもかしこも〇〇牛みたいなブランド牛で戦ってもう差別化が難しいんですよね,提供価値が機能的価値（スペックや性能）になってしまっているためお金さえ払えば誰でも簡単に参入できてしまうんです,焼肉店が生き残る鍵は体験などの情緒的価値を先に設計し真似されにくいお店作りにすることです,新店舗、どこもかしこも〇〇牛みたいなブランド牛で戦ってもう差別化が難しいんですよね,今伸びてるもの,5
6,炭火焼きのお店、焼き台に立てる人が増えない問題にぶち当たってませんか？,炭火焼きのお店、焼き台に立てる人が増えない問題にぶち当たってませんか？,炭火焼きのお店の焼き場、いつも人手に困ってませんか？,"「技術職」なのは確かですが、教育の仕方がいまだに「見て覚えろ」止まりじゃないですか？
それって職人ではなく教育じたいが属人化させているんじゃないですか？","「焼ける／焼けない」で判断せずに、いきなり全部任せないように段階を切って段階ごとにOKラインを決めること
失敗も許容してあげながら少しずつ成功体験を積ませて行きましょう",炭火焼きのお店、焼き台に立てる人が増えない問題にぶち当たってませんか？,今伸びてるもの,6
7,焼き鳥は安いもんってイメージのせいで単価取れてへんお店はしんどいですよね,焼き鳥は安いもんってイメージのせいで単価取れてへんお店はしんどいですよね,焼き鳥は「安いもん」という市場イメージが強く単価を取り切れていない店が多いって知ってましたか？,これは個別店の努力不足ではなく市場側の固定観念が強すぎるため、業態が抱えるブランディング問題です,ポジショニングの再定義をし、「焼き鳥を売る店」なのか「焼き鳥が手段の店」なのかを決めると未来が見えますよ,焼き鳥は安いもんってイメージのせいで単価取れてへんお店はしんどいですよね,今伸びてるもの,7
8,パン屋は廃棄を減らすほど、お客の満足と単価が下がるジレンマ（ロスパン安い）,パン屋は廃棄を減らすほど、お客の満足と単価が下がるジレンマ（ロスパン安い）,パン屋は、廃棄を減らすほどお客様の満足度と単価が下がる、かなり残酷なジレンマがあります。,"廃棄を価格で処理するお店は長期的に必ず単価が落ちます
理由はシンプルでお客様は正規価格を高いと感じ始めるからです","廃棄を減らしたいなら安く売るのではなく、売り方・量・時間・ラインナップを
設計し直すことです",パン屋は廃棄を減らすほど、お客の満足と単価が下がるジレンマ（ロスパン安い）,今伸びてるもの,8
9,うちはイタリアンやからパスタ出したいけどオペレーションがどうしても,うちはイタリアンやからパスタ出したいけどオペレーションがどうしても,パスタは「頑張って回す」を選んで現場を壊します,"その条件なら生麺に変える判断ならアリです
理由はシンプルで茹で時間・再現性・技術依存を一気に下げられるから","・ピークの同時提供数
・鍋と火口の数
・新人でも作れるか
この3つを整理してから初めて選ぶ選択肢です
これを考えずに生麺にしてもたぶん何も解決しません",うちはイタリアンやからパスタ出したいけどオペレーションがどうしても,今伸びてるもの,9
10,せっかく仕入れたワイン、抜栓しても売り切れんから困ってるビストロから相談いただくんですが,せっかく仕入れたワイン、抜栓しても売り切れんから困ってるビストロから相談いただくんですが,"せっかく仕入れたワイン抜栓しても売り切れん
これビストロの相談でいちばん多い悩みです","・メニューor黒板で主役にした
・スタッフ全員が一言で勧められる
・値引きではなく理由付けで提案している
全部にチェックがつかないなら売れないのは当然です","もし抜栓ワインが残り続けてるならそれは仕入れの失敗ではなく売り方を決めずに
開けてる設計ミスです
次に抜栓する一本を何杯で・いつまでに売り切るかを決めてから開けてください",せっかく仕入れたワイン、抜栓しても売り切れんから困ってるビストロから相談いただくんですが,今伸びてるもの,10
11,ハンバーガー業態を選ぶ方は本気で覚悟した方がいい事実（マクド）,ハンバーガー業態を選ぶ方は本気で覚悟した方がいい事実（マクド）,ハンバーガー業態を選ぶなら本気で覚悟した方がいいですよ,"なぜなら一般人のイメージは競合がマクドナルドだからです
なので美味しいだけでは絶対に勝てません
価格、スピード、安定感、認知、全てにおいて個人店はほぼ負けます","マクドと比べられない設計を先に作ること
・時間
・価格
・食べる理由
・使うシーン
ここをずらせないなら、ハンバーガー業態は絶対に選ばない方がいい",ハンバーガー業態を選ぶ方は本気で覚悟した方がいい事実（マクド）,新テーマ,11
12,暑くなる時期の食中毒対策,暑くなる時期の食中毒対策,食中毒対策、暑くなる前から始めんと手遅れになりますよ,"・夏だけ仕込み量を減らす
・ピーク前後で触る食材を固定する
・判断が必要な工程を一つ減らす
・冷蔵庫の使い方を人基準から場所基準に変える",この夏、注意喚起を増やす前に、一工程だけ減らせないかそれを考えてください,暑くなる時期の食中毒対策,トリガー,12
13,タンとハラミばっかり出てしんどいわって焼肉店のオーナーさん（メニュー表、指南書メニュー）,タンとハラミばっかり出てしんどいわって焼肉店のオーナーさん（メニュー表、指南書メニュー）,タンとハラミばっかり出てしんどいわって焼肉店のオーナーさん,タンとハラミが出すぎるお店は注文を設計できていないお店です,"同じ場所・同じ文字サイズに置く必要はありません
・出したい肉
・利益が残る肉
・在庫を回したい肉
これを意図的に目立たせることが重要です",タンとハラミばっかり出てしんどいわって焼肉店のオーナーさん（メニュー表、指南書メニュー）,過去に伸びたもの,1
14,昼ピークで終わる、夜対策してへん蕎麦屋さん,昼ピークで終わる、夜対策してへん蕎麦屋さん,"昼ピークで終わる、夜対策してへんお蕎麦屋さん
昼の営業のまま夜惰性でやってませんか？","夜のお客は時間を使って何を楽しむかを選びに来てるので
同じ蕎麦を出してるだけで勝てるわけがない","昼が強いから仕方ないはただの思考停止です
夜に必要なのは商品じゃなく来店するための理由です",昼ピークで終わる、夜対策してへん蕎麦屋さん,過去に伸びたもの,2
15,“安定”という言葉が存在しない=キッチンカー　ブランドにお客様が付かない,“安定”という言葉が存在しない=キッチンカー　ブランドにお客様が付かない,キッチンカーには安定という言葉が存在しません,キッチンカーでお客様がお店に付かないのは場所か習慣でしか覚えてないからです,"キッチンカーで店名を覚えてもらおうとしているなら戦い方を間違えています
キッチンカーでやるべき正解はブランド作りじゃくて一発で選ばれる理由を毎回作ることです",“安定”という言葉が存在しない=キッチンカー　ブランドにお客様が付かない,過去に伸びたもの,3
16,特別な日需要で戦ってるケーキ屋さんは長く持ちません,特別な日需要で戦ってるケーキ屋さんは長く持ちません,"誕生日がないと思い出されへんケーキ屋さん
「このお店何もない日は来られへんわ」って思われてますよ","ケーキ屋を長く続けたいなら特別じゃない日に買われる理由が必要です
何もない日に選ばれへんお店は売上も人も安定しません","サイズを日常サイズに落としたり、自分用ブランディングをしてみたり、曜日戦略もあります。
明日できることから初めて見たいので、ぜひこんなことしてますよっていう実例はコメントお願いします！",特別な日需要で戦ってるケーキ屋さんは長く持ちません,過去に伸びたもの,4
17,夏の鍋屋さん、冬のアイス屋さん さてどう戦いますか？,夏の鍋屋さん、冬のアイス屋さん さてどう戦いますか？,夏の鍋屋さん、冬のアイス屋さん さてどう戦いますか？,"夏の鍋屋：「うちの鍋はあっさりで夏でも美味しい」
冬のアイス屋：「暖房の効いた店内で食べると美味しい」
みたいな商品説明してないですよね？
こういう時こそタイミングトリガーを使ってください","状態の定義をして状態に名前をつけてあげてください
みなさんはどうやって戦ってますか？ぜひ教えてください","夏の鍋屋さん、冬のアイス屋さん
さてどう戦いますか？",今伸びてるもの,5
18,お好み焼きの地域の話＋おでんの牛すじ,お好み焼きの地域の話＋おでんの牛すじ,"お好み焼きって、関西と関東で出てき方が全然違うの知ってましたか？
こういう文化の違いを経営のヒントに落とし込めてこそ経営者です","関西は焼いたものが出てくる
関東は焼く前の状態が出てきて自分で焼く
これ料理の違いじゃなく何を楽しむかの違いです",もんじゃの文化もあるからかもしれませんが、焼く体験やそこでの会話がコンテンツになってるのが関東なんです,お好み焼きの地域の話＋おでんの牛すじ,今伸びてるもの,6
19,商業施設集客で困ってるオーナーは絶対に意識すべき,商業施設集客で困ってるオーナーは絶対に意識すべき,商業施設集客で困ってるオーナーほどSNSをやってはいけないです,"「目的来店」じゃなく「ついで需要」を取りにいくということを理解しないといけないです
ということはSNSなどで来店理由を発信するのではなく立ち寄り理由を作ることが先決です","商業施設は良い店が勝つ場所じゃなくて分かりやすい店が勝つ場所です
☑︎「〇〇のついでに」が言語化されている
☑︎ 店頭で一文で分かる
 ☑︎初来店の一択がある
 ☑︎隣の店を意識している
 ☑︎時間帯で売り方が違う
このチェック3つ以下なら、集客できないのは実力じゃなく準備不足です",商業施設集客で困ってるオーナーは絶対に意識すべき,今伸びてるもの,7
20,インバウンドや観光頼りの飲食店さん、オフシーズンの準備は完璧ですか？,インバウンドや観光頼りの飲食店さん、オフシーズンの準備は完璧ですか？,インバウンドや観光頼りの飲食店さん、オフシーズンの準備は完璧ですか？,"暇になる時の準備をしてる店はほとんどありません
耐え方を先に決めるだけの話です","オフシーズンは、頑張る時期じゃありません
もし今、忙しいから後で考えると思っているならそれが一番危ないです
明日一回観光客がいない前提で自分の店を見直してみてください
それができる店だけが次の繁忙期を強く迎えられます",インバウンドや観光頼りの飲食店さん、オフシーズンの準備は完璧ですか？,今伸びてるもの,8
21,インバウンド特化にして日本人が入りづらいって言ってたら経営者失格です,インバウンド特化にして日本人が入りづらいって言ってたら経営者失格です,インバウンド特化にしてるくせに日本人が入りづらいって言ってたら経営者失格です,あえて対象外のペルソナを指定することでマーケティングをしやすくする戦略もあるんです,"特化とは他を切ることではないです
切っても壊れない状態を先に作ることです",インバウンド特化にして日本人が入りづらいって言ってたら経営者失格です,今伸びてるもの,9
22,GW明けでスッタフがやめたのがじわじわ効いてきてる頃ちゃいますか？,GW明けでスッタフがやめたのがじわじわ効いてきてる頃ちゃいますか？,GW明けでスッタフがやめたのがじわじわ効いてきてる頃ちゃいますか？,"人が辞めた店で本当に困るのは人手不足じゃなくて
新人を迎える準備が何もなかったことです","新人が迷わず動ける状態を作ること
・最初の1日で何をやるか
・1週間でどこまで任せるか
・誰に聞けばいいか
これが決まってない店ほど人は早く辞めます",GW明けでスッタフがやめたのがじわじわ効いてきてる頃ちゃいますか？,今伸びてるもの,10
23,歓送迎会のフィーバーが落ち着いて焦ってませんか？,歓送迎会のフィーバーが落ち着いて焦ってませんか？,歓送迎会のフィーバーが落ち着いて焦ってませんか？,"「売上が落ちた」のではなく、集客の準備を一切してへんかっただけ
歓送迎会という自動で人が動くボーナス期間に、何も仕込まずに終わったことが問題です
やることは3つ
・新規客を一見”で終わらせない設計
・次に来る理由（用途・名目）を事前に刷り込む
・繁忙期中に「次の売上の種」を回収する","忙しい時にマーケを考えていない店は、必ず暇な時に焦ります
歓送迎会で来た人たちに、次に来る理由を用意していたか？を正直に振り返ってください",歓送迎会のフィーバーが落ち着いて焦ってませんか？,新テーマ,11
24,ロスリーダー戦略も知らんと原価決めてたら隣の店舗に勝てませんよ,ロスリーダー戦略も知らんと原価決めてたら隣の店舗に勝てませんよ,ロスリーダー戦略も知らんと原価決めてたら隣の店舗に勝てませんよ,"価格は「集客用」「利益回収用」「比較回避用」に分けて設計してください
ロスリーダー戦略の本質は、「安く売ること」じゃなくてどの商品で客を連れてきて、どこで利益を取るかを決めて役割分担することです","今日やれることは一つ。
メニューを見て、「これは集客用か？利益用か？それとも何も考えてないか？」
この3択で全商品を仕分けてみてください",ロスリーダー戦略も知らんと原価決めてたら隣の店舗に勝てませんよ,トリガー,12
25,給料上げてもスタッフは辞めます,給料上げてもスタッフは辞めます,給料を上げても、スタッフは普通に辞めます,"人は「評価が不明確な環境」から必ず離れます。
辞める店に共通しているのはこの3つです。
・何を頑張れば評価されるのか分からない
・怒られる基準はあるが、褒められる基準がない
・店長や社長の機嫌で扱いが変わる",給料を上げる前に期待値と評価基準を言語化し、再現できる状態にすることです,給料上げてもスタッフは辞めます,過去に伸びたもの,1
26,キッチンカー経営なめたらあかん,キッチンカー経営なめたらあかん,キッチンカー経営を「初期費用が安いから簡単」ってなめたらあかん,"「事業としての前提条件」が、普通の飲食店と全く違うからです
キッチンカーは「飲食店」ではなく「移動型マーケティング事業」です
難しいと言われる理由は主に3つ。
・売上が「立地」ではなく「日と時間」に完全依存する。
・集客と営業を全部自分でやらないといけない。
・スケールしにくい。","キッチンカーは“楽な独立”じゃありません。
「自分は料理人か？それとも営業マンか？」を正直に決めてください。
この質問の意味を理解した上でやる人だけが、生き残ります。",キッチンカー経営なめたらあかん,過去に伸びたもの,2
27,お金がない！銀行に借りよう！が一番失敗します（貸してくれへん）,お金がない！銀行に借りよう！が一番失敗します（貸してくれへん）,融資は、返せる状態が説明できる人にしかお金は出ません,"融資が出る条件は「熱意」でも「夢」でもありません
返済原資が数字で説明できること、お金の使い道が“利益に変わる構造”になっていること、すでに管理できている実績があること
ここしかみられません","最低限、これだけは、即答できる状態にしておくべきです。
・営業利益はいくらか
・人件費率・原価率はいくらか
・この利益から、毎月いくら返せるか",お金がない！銀行に借りよう！が一番失敗します（貸してくれへん）,過去に伸びたもの,3
28,アルコールを売ろうとしてるのは時代遅れです,アルコールを売ろうとしてるのは時代遅れです,アルコールを売ろうとしてるのは時代遅れです,ノンアルを代替ではなく主役候補として持ち上げつつ、滞在時間・会話・食事そのものを価値付けし、「飲まなくても来ていい店」というメッセージを明確に出して行きましょう,"あなたのお店、飲まない人が楽しめる設計になっていますか？
酒を売る店は減ります。今後居心地を売る店が残る時代になるのでしっかり意識して行きましょう",アルコールを売ろうとしてるのは時代遅れです,過去に伸びたもの,4
29,店長の熱量とアルバイトの熱量に差が出始めたら危険信号です,店長の熱量とアルバイトの熱量に差が出始めたら危険信号です,店長の熱量とアルバイトの熱量に差が出始めたら危険信号です,"店長が熱く語れば語るほど人が離れて行きます
今後は数字・目的・因果・判断基準を軸に会話をしてください","ただ、創業初期や少人数フェーズでは、一時的にパッション主導が機能する場合もあります
組織になろうとした瞬間切り替えるべきです",店長の熱量とアルバイトの熱量に差が出始めたら危険信号です,今伸びてるもの,5
30,ラストオーダー30分前、めちゃくちゃ嫌な顔されました,ラストオーダー30分前、めちゃくちゃ嫌な顔されました,ラストオーダー30分前、めちゃくちゃ嫌な顔されました,"その店は次の来店を自分で捨てています
「閉店間際＝単価が下がる・いいお客様が来ない時間帯」だと、お店側が勘違いしていること","閉店間際の接客が、その店の本性です
接客は営業時間中ずっと同じ価値です
閉店が近いほど、雑にしていい時間帯なんて存在しません",ラストオーダー30分前、めちゃくちゃ嫌な顔されました,今伸びてるもの,6
31,厨房面積比率,厨房面積比率,厨房面積比率を理解せずに店を作ると開業した瞬間から利益が出ない構造が完成します,"厨房面積比率は“料理”ではなく“オペレーション”から逆算する必要があります
・一般的な飲食店：30〜40％
・オペが軽い業態：25〜30％
・仕込み重め／専門業態：40％","厨房が広すぎると席数が減って売上上限が下がる
狭すぎるとオペレーションが詰まり人件費が跳ねる
人件費率と売上天井を同時に決めているということです",厨房面積比率,今伸びてるもの,7
32,賄いは課税対象,賄いは課税対象,無料で賄い出してたら税務調査で突っ込まれますよ,"(1) 従業員が食事の価額の半分以上を負担していること
(2)（食事の価額 − 従業員負担額）が 1か月当たり 3,500円以下（税抜）であること
この2つが同時に満たされている必要があります。","賄いは条件を満たさない限り、給与課税です
賄いは善意で出すのではなく税法に従って提供しましょう",賄いは課税対象,今伸びてるもの,8
33,法人or個人,法人or個人,法人or個人で迷う人の9割は、最大の違いを見れてないです,"個人事業主の最大のメリットは何よりも固定コストがほぼ無い身軽さです
逆に最大のデメリットは利益が出るほど、全部「自分の所得」になること

法人の最大のメリットはお金を「分けて設計できる」こと
最大のデメリットは固定コストから逃げられないです",個人は稼げば稼ぐほど、個人は苦しくなるので稼ぐフェーズに入った瞬間法人成りは視野に入れましょう,法人or個人,今伸びてるもの,9
