No.,テーマ,フック（0-5秒）,共感（5-12秒）,前提知識（12-21秒）,メイン解説（21-30秒）,解説まとめ（30-32秒）,実践（32-44秒）,CTA（42-45秒）
1,化粧水のあと、どのくらいで乳液を塗ればいい？,化粧水のあと、すぐに乳液を重ねていませんか？ちょっと待って！3〜5分のインターバルが美肌の分かれ道なんです,せっかちな方もマイペースな方も、実はタイミングで保湿効果が全然違うって気づいていましたか？今回は肌がもっとも水分を欲しがる黄金のタイミングを科学的にお伝えします,肌の表面にある角質層は、わずか0.02mmという薄い層ですが、水分を保持する大切なバリアなんです。化粧水で水分を補給した後、その水分が蒸発しないように油分でフタをする必要があります。化粧水が肌になじむには数分の時間が必要で、この浸透を待ってから乳液を重ねることで保湿効果が持続するんです,つまり、化粧水を塗った後は3〜5分程度待ってから乳液を使うのが理想的です。化粧水が肌になじんでべたつきがなくなったタイミングが目安ですね,まとめると、化粧水の浸透を待ってから乳液を塗ることで、保湿効果を最大限に引き出せるということです,ただし、最新の研究では厳密に時間を計る必要はないことも分かっています。肌が乾く前に乳液を塗る習慣をまずは身につけましょう。明日の朝から、化粧水のべたつきがなくなったら乳液、この流れを試してみてください,保存してご自身のスキンケアにお役立てください。他にも気になることがあればコメントでお聞かせくださいね
2,お風呂上がりすぐに塗らないとダメ？,実は、お風呂上がりのスキンケアって30分以内なら十分間に合うんですよ,「すぐに塗らなきゃ！」って焦った経験、ありませんか？髪を乾かす間もドキドキしちゃって。でもね、最新の研究では意外な事実が判明したんです,お風呂では角質層が水分で満たされますが、浴室から出ると急に湿度が下がって水分が蒸発しやすくなります。湿った肌が乾く過程で、角質層内部の水分まで一緒に奪われてしまい、入浴前より乾燥してしまうことがあるんです。化粧水や保湿剤は、この水分蒸発を防ぐバリアの役割を果たします,最新の研究では、保湿剤を入浴1分後に塗った場合と1時間後に塗った場合で角質層水分量に有意な差はないという結果が出ています,つまり、「すぐに」という時間にこだわりすぎる必要はなく、肌が完全に乾く前にケアすることが大切なんです,お風呂上がり30分以内を目安にスキンケアを始めましょう。まずは髪を乾かして、着替えを済ませてから、落ち着いてスキンケアをする。この流れで十分効果的です,保存して今夜からゆとりを持ったスキンケアを始めてみてください。時間に追われずに丁寧なケアができますよ
3,朝の保湿と夜の保湿はどう違うの？,朝と夜、同じクリームで済ませている方へ。肌にも体内時計があるって知っていました？,忙しい朝も疲れた夜も、とりあえず同じケアで...という習慣、見直し時かもしれません。実は時間帯によって肌が求めるものが180度違うんです,私たちの肌にもサーカディアンリズムがあります。昼間は外部刺激から肌を守る保護機能が高まり、夜は肌の修復・再生を担う回復機能が活発になります。また、水分蒸散量は夕方から夜にかけて最も多く、朝8時から10時頃に最小となるんです,朝の保湿は「守る」ことが目的で、日中の刺激からバリアする役割が重要です。夜の保湿は「回復する」ことが目的で、日中のダメージ修復をサポートします,まとめると、朝はプロテクト、夜はリペアと、それぞれに最適化された保湿が効果的なんです,水分蒸散量が夜により多くなることを考慮して、まずは夜の保湿を重点的に行いましょう。朝はさっぱり、夜はしっとりとした使用感の製品を使い分けることで、肌本来のリズムをサポートできます,保存して朝と夜の使い分けを始めてみてください。肌本来のリズムに合わせたケアを体感してくださいね
4,化粧水と美容液って何が違うの？,さあ、問題です！化粧水と美容液、この2つの違いをパッと答えられますか？,「どっちも保湿でしょ？」と思ったあなた、惜しい！でも実はそれぞれに特別な使命があるんです。今日はその秘密を解き明かしましょう,角質層への成分浸透は分子量の大きさが重要で、一般的に分子量600以下の成分が通過しやすいとされています。化粧水は主に水分補給を目的とした水性の基剤で、美容液は特定の美容成分を高濃度で配合した集中ケア用アイテムです。美容液は化粧水よりも成分濃度が高く、粘度のあるテクスチャーを持ちます,化粧水は肌全体に水分を与えて次のアイテムの浸透を助ける土台作り、美容液は特定の肌悩みに高濃度成分でアプローチする集中ケアなんです,つまり、化粧水は基本の水分補給、美容液は特別なお悩みケアということですね,スキンケア初心者の方は、まず化粧水で基本的な保湿習慣を身につけることから始めましょう。肌の調子が安定してきたら、気になる悩みに合わせて美容液をプラスするのが効果的です,保存してスキンケアの基本を見直してみてください。段階的にアイテムを増やしていけば失敗しませんよ
5,順番を変えると効果はなくなる？,乳液を先に塗っちゃった！そんな朝の大失敗、実はそこまで悲観することもないんですが...,でも効果は確実に半減しちゃいます。なぜ順番がそんなに大切なのか、その理由を知れば、もう二度と間違えなくなりますよ,皮膚のバリア機能は水分と油分のバランスが適切に保たれているときに最も健やかに働きます。スキンケアには「水っぽいものから油っぽいものへ」という基本ルールがあります。これは、先に油分の多いものを使うと後から使う水性のアイテムが弾かれてしまうからです,順番を間違えると美容成分が肌に届きにくくなったり、保湿効果が半減したりします。完全に効果がなくなるわけではありませんが、最適な結果を得るためには正しい順序が重要です,まとめると、正しい順番でこそスキンケアアイテムの効果を最大限に引き出せるということです,基本の流れは洗顔→化粧水→美容液→乳液です。まずはこの順序を守ることから始めましょう。慣れてくれば自然に体が覚えて、忙しい朝でも間違えなくなりますよ,保存して正しい順番を確認してください。明日の朝から意識して使ってみてくださいね
6,オールインワンで十分なの？,オールインワンのジャー、これ1つで本当に大丈夫ですか？実は年齢と肌質がすべてを決めるんですよ,時短もコスパも最高！そう思って使っているあなたに、ちょっと考えてほしいことがあるんです。それぞれの機能が薄まっているかもしれないって、気づいていましたか？,肌のバリア機能を維持するには水分と油分の適切なバランスが必要で、年齢とともにこのバランスが崩れやすくなります。30代以降は皮脂分泌が減少し、角質層の水分保持能力も低下していきます。オールインワンは複数の機能を一つにまとめているため、個別アイテムと比べると各機能の効果が薄まる可能性があります,20代で皮脂分泌が活発な方や忙しい方には適していますが、乾燥が気になる方や年齢を重ねた肌には物足りない場合があります,つまり、オールインワンで十分かどうかは肌質と年齢、ライフスタイルによって決まるということです,まずはオールインワンで基本的なケア習慣を身につけて、肌の状態を観察してみましょう。物足りなさを感じたら個別アイテムを追加していく、この段階的なアプローチがおすすめです,保存してご自身の肌と向き合ってみてください。今の肌に必要なケアが見えてきますよ
7,「アルコールフリー」って本当に肌にいいの？,みなさん、アルコールフリーの真実を知っていますか？万能ではないんです,「敏感肌ならアルコールフリーでしょ？」って決めつけているなら、ちょっと待ってください。肌質によっては逆効果になることもあるんですよ,敏感肌は角質層のバリア機能が低下して外部刺激に過敏に反応しやすい状態です。化粧品の「アルコールフリー」は主にエタノールを指しており、成分表示では「エタノール」と記載されます。エタノールは揮発性が高く、肌から水分を奪って乾燥を引き起こす可能性がありますが、殺菌作用や収れん作用もあります,敏感肌や乾燥肌には一般的に良い選択ですが、脂性肌やニキビ肌の方には有効な場合もあります。重要なのは成分表示で「エタノール」の有無を確認することです,まとめると、アルコールフリーは万能ではなく、自分の肌質に合わせて選ぶことが大切なんです,アルコールフリーと表示されていても他のアルコール系成分が含まれている可能性があるため、敏感肌の方は購入前にパッチテストを行いましょう。まずは少量から試して肌の反応を確認することから始めてください,保存してスキンケア選びの参考にしてください。成分表示をしっかり確認する習慣をつけましょうね
8,敏感肌でも使えるビタミンCってある？,敏感肌だからビタミンCは無理、そう諦めていませんか？油溶性タイプなら大丈夫ですよ,刺激が怖い、赤みが出そう、ヒリヒリしそう...そんな不安でビタミンCを諦める気持ち、よくわかります。でも今日お伝えする方法なら、敏感肌でも安心して始められます,ビタミンCにはコラーゲン合成促進や美白効果がありますが、純粋なビタミンC（アスコルビン酸）は不安定で刺激性が強く、敏感肌には赤みやヒリヒリ感を引き起こす可能性があります。ビタミンCには水溶性、油溶性、両親媒性があり、油溶性ビタミンC誘導体は穏やかで持続性があります,最も適しているのは油溶性ビタミンC誘導体で、水溶性タイプに比べて刺激が少なく乾燥肌や敏感肌におすすめです,つまり、敏感肌でもビタミンCの種類と濃度を選べば安全に使えるということです,低濃度（1-3%）から始めて、夜のスキンケアに取り入れることから始めましょう。不安な方は美容皮膚科で医師の管理下で安全にビタミンCを取り入れることができるため、専門医に相談することをおすすめします,保存して敏感肌のビタミンCデビューに活用してください。慎重に始めれば美容効果を実感できますよ
9,成分表のどこを見れば安心？,成分表のカタカナ地獄にお疲れのあなた、上位5成分だけチェックすればOKです,全成分を理解しなきゃいけないなんて、無理ですよね？実はポイントを絞れば、サッと見るだけで安全性が判断できるんです,化粧品の全成分表示は配合量の多い順（通常1%以上）に記載され、1%以下の成分は順不同で表示されます。この「1%ライン」を理解すると主要成分と微量成分を区別できます。敏感肌の方は、アレルゲンとなりやすい成分や刺激の強い成分に過敏に反応する傾向があります,上位5-6成分をチェックして、刺激となりやすい「エタノール」「香料」「合成着色料」「パラベン」が含まれていないかを確認しましょう,つまり、全成分を覚える必要はなく、上位の主要成分だけチェックすれば十分ということです,敏感肌の方は成分数の少ないシンプルな処方の製品から始めることをおすすめします。不安な場合は皮膚科専門医に相談して、自分の肌に適した成分を把握しておきましょう,保存してお買い物の時の成分チェックに活用してください。安心してスキンケアを選べるようになりますよ
10,マスクでニキビができるのはなぜ？,もううんざり！マスクをつけるたびにニキビが増えるって、一体なんなんでしょう？,マスク生活で肌荒れに悩んでいるのは、あなただけじゃありません。蒸れと摩擦がダブルパンチで肌を痛めつけているんです。今からそのメカニズムを解明します,マスク内は呼気によって高温多湿状態となり、アクネ菌などの細菌が繁殖しやすい環境になります。また、マスクの着脱や口の動きによる摩擦が角質層を傷つけて、皮膚のバリア機能を低下させます。蒸れによって皮膚がふやけた状態になると、摩擦に対してより敏感になります,蒸れによる細菌繁殖と摩擦による皮膚刺激の両方が同時に起こることで、毛穴詰まりと炎症が起こりやすくなります,つまり、マスクニキビは環境要因と物理的刺激の複合的な問題なんです,対策として肌に優しい素材のマスクを選び、適切なサイズを使用しましょう。また、マスクを外した際の清潔なケアと、過度に刺激しないスキンケアを心がけることが重要です,保存してマスクニキビ対策に活用してください。毎日のちょっとした工夫で改善できますよ
11,マスクの素材で肌荒れしやすさは変わる？,不織布、綿、ウレタン...どれでも同じじゃないって知ってました？,「どのマスクでも肌荒れしちゃう」そんなあなたは素材選びで解決できるかも。実は肌に優しい素材には明確なランキングがあるんです,皮膚は外部からの物理的刺激に対して炎症反応を起こす性質があります。マスクの主な素材には不織布、綿などの天然繊維、ポリウレタンなどの合成繊維があり、それぞれ通気性、肌触り、耐久性が異なります。特に敏感肌やアトピー性皮膚炎の方は繊維による刺激性接触皮膚炎を起こしやすい傾向があります,一般的に肌に最も優しいのは綿などの天然繊維、次に不織布、最も刺激となりやすいのがポリウレタンなどの合成繊維です,まとめると、素材選びは肌荒れ予防の重要なポイントということですね,肌荒れが気になる方は、まず綿100%の布マスクから試してみましょう。それでも改善しない場合は、マスクの問題ではなく蒸れや摩擦によるケア方法を見直すことが重要です,保存してマスク選びの参考にしてください。自分の肌に合う素材を見つけて快適に過ごしましょう
12,マスクの下に日焼け止めは必要？,もう日焼け止め塗ってません？マスクがあるからって安心してるとシミがびっしりできちゃいますよ,マスクで顔の半分は隠れてるし、朝の忙しい時間に日焼け止めまで塗るの面倒...そう思っちゃいますよね。でも、実はマスクの紫外線カット効果ってほとんどないんです,紫外線にはUV-AとUV-Bがあり、UV-Aは真皮まで到達してコラーゲンを破壊し、UV-Bは表皮に作用してメラニン生成を促進します。紫外線は窓ガラスや薄い布を透過する性質があり、一般的な布マスクや不織布マスクのUVカット効果はSPF5-10程度と限定的です,マスクのUVカット効果は限定的で、目の周りや頬の上部はマスクで覆われていないため、日焼け止めによる確実な紫外線対策が重要です,つまり、マスクは補助的な役割で、基本的な紫外線対策は日焼け止めが必要ということです,マスク内は蒸れやすいため、軽いテクスチャーでノンコメドジェニック処方の日焼け止めを選びましょう。朝のスキンケアの最後に、マスクを着用する前に日焼け止めを塗る習慣をつけることから始めてください,保存してマスク生活の紫外線対策に活用してください。将来の肌のために今からしっかりケアしましょう
13,ヒアルロン酸って肌にどう効くの？,え？ヒアルロン酸1gで水6リットルも抱え込めるって知らなかったですか？,「ヒアルロン酸配合」の化粧水を使ってるのに、なんだか効果がイマイチ...そんなモヤモヤした経験ありませんか？実は分子サイズで働き方が全く違うんです,ヒアルロン酸は人体に元々存在する高分子多糖で、皮膚では真皮に多く存在してコラーゲンやエラスチンとともに肌の弾力と潤いを保っています。加齢とともに体内のヒアルロン酸は減少し、肌の乾燥やたるみの原因となります。化粧品には分子量によって高分子と低分子の種類があります,高分子ヒアルロン酸は肌表面で保湿膜を形成し、低分子ヒアルロン酸は角質層により浸透しやすく、それぞれ異なる保湿効果を発揮します,つまり、ヒアルロン酸は分子量によって働く場所が違い、両方が肌の保湿に貢献しているということです,ヒアルロン酸配合の化粧品を選ぶ際は、まず高分子タイプから始めて肌表面の保湿を重点的に行いましょう。即効性のある保湿効果を実感できるはずです,保存してヒアルロン酸選びの参考にしてください。乾燥知らずの潤い肌を目指しましょう
14,ビタミンCは食べるのと塗るの、どっちがいい？,毎日レモン食べて美肌を狙ってる？残念ながら、それって効率悪いかもしれません,レモン10個分のビタミンCを摂っても、肌に届く量はわずか...そんな話聞いたことありませんか？内側からのケアって思ってたのに、ちょっとがっかりですよね,経口摂取されたビタミンCは消化管で吸収され、血流を通じて全身の臓器に運ばれますが、肌は優先順位が低いため内臓や脳などに先に使われ、肌に到達する量は限定的です。一方、外用によるビタミンCは直接肌に作用するため局所的な効果が期待できます,外用では、シミやくすみの改善、皮脂分泌の調整、紫外線ダメージの修復など局所的で即効性のある効果が期待できます,つまり、美肌効果を重視するなら塗るビタミンCが効率的ということです,理想的なのは内外両方からのアプローチです。まずは朝のスキンケアにビタミンC誘導体配合の美容液を取り入れて、同時にビタミンC豊富な果物や野菜を日常的に摂取することで総合的な美容効果を目指しましょう,保存してビタミンCの効果的な取り入れ方に活用してください。内外からのケアで美肌を手に入れましょう
15,レチノールって敏感肌でも使える？,レチノールで皮むけするから諦めた？実は、正しい方法なら敏感肌でも使えるんです,シワに効くって聞いてレチノールを試したけど、赤くなっちゃって断念...そんな経験をお持ちの方、実は始め方が間違っていただけかもしれません,レチノール（ビタミンA）は皮膚の細胞分裂を促進してコラーゲン生成を増加させますが、同時にターンオーバーを加速させるため一時的に角質層が薄くなり、「A反応」と呼ばれる赤み、乾燥、皮むけが起こることがあります。化粧品グレードから医療グレードまで濃度は幅広く、夜間使用が基本です,敏感肌でも使用可能ですが、最も重要なのは低濃度から始めることで、0.1%以下の製品を週に2-3回から開始するのが安全です,つまり、敏感肌でも濃度と頻度を調整すれば安全にレチノールの効果を得られるということです,A反応が出た場合は使用を一時中断し、症状が治まってから頻度を調整して再開します。アトピー性皮膚炎や重度の敏感肌の方は、皮膚科で相談してから始めることが安全で効果的です,保存して敏感肌のレチノールデビューに活用してください。慎重スタートでエイジングケア効果を実感できますよ
16,寝不足すると肌が荒れるのはなぜ？,寝不足の次の日、「疲れた顔してるね」って言われたことありませんか？,残業続きで睡眠時間が削られて、朝鏡を見たら顔色が悪い...そんなとき「疲れてるからしょうがない」と思いがちですが、実は肌の内側で大変なことが起きているんです,睡眠中に分泌される成長ホルモンは皮膚の細胞分裂と修復に重要な役割を果たしています。成長ホルモンは睡眠に入ってから最初の深いノンレム睡眠時に最も多く分泌され、肌のターンオーバーを促進します。睡眠不足になると、この分泌が不足して古い角質が蓄積し、毛穴詰まりやくすみの原因となります,さらに睡眠不足はストレスホルモンの分泌を増加させ、皮脂分泌の増加や炎症反応の促進につながり、肌荒れを悪化させる悪循環を生みます,まとめると、寝不足は肌の修復機能を低下させ、同時にトラブルを増加させる二重の悪影響があるということです,美肌のためには7-8時間の質の良い睡眠を確保しましょう。就寝前のスマートフォンを控え、リラックスできる環境を整えることが重要です。まずは就寝時間を30分早めることから始めてみてください,保存して睡眠習慣の見直しに活用してください。今夜から早寝を心がけて美肌を目指しましょう
17,「ゴールデンタイム」に寝ないと本当にダメ？,22時就寝なんて無理すぎる...もしかしてゴールデンタイムって都市伝説でした？,美肌のために22時には寝なきゃって思ってるけど、実際は仕事で帰宅が遅くて無理...そんな罪悪感を感じていませんか？安心してください、最新研究では時間よりも睡眠の質が重要だとわかってきました,従来「22時から2時のゴールデンタイム」が美肌に重要とされてきましたが、最新の睡眠科学では成長ホルモンの分泌は時刻ではなく「その夜最初に訪れる深いノンレム睡眠」に依存することが明らかになっています。成長ホルモンは入眠後30分から3時間の間に最も多く分泌され、これは何時に寝ても変わりません,美肌に重要なのは特定の時間帯に寝ることではなく、入眠後最初の深い睡眠をしっかりと確保することです,つまり、「いつ寝るか」より「どれだけ質の良い睡眠を取れるか」が美肌には大切なんです,毎日同じ時間に寝起きする規則正しい生活リズムを保つことは体内時計を整える上で重要です。まずは自分のライフスタイルに合った就寝時間を決めて、それを継続することから始めましょう,保存してご自身に合った睡眠リズムを見つけてください。時間帯よりも睡眠の質と継続性を重視しましょう
