18,寝る前にできる美肌習慣ってある？,スキンケア後はいつもスマホでダラダラ...これ、美肌チャンスを逃してますよ,夜のお手入れが終わったら、ついベッドでスマホを見ちゃう...そんな方、実はもったいないことしてるって気づいてますか？寝る前の過ごし方を変えるだけで、翌朝の肌が見違えるほど変わるんです,睡眠中は副交感神経が優位になり血流が促進されて肌の代謝と吸収率が高まります。成長ホルモンの分泌により肌の修復・再生が活発になるため、このタイミングに合わせたケアが効果的です。睡眠前の1-2時間は心身をリラックス状態に導く準備時間として重要です,夜用スキンケアと良質な睡眠環境の整備が最も効果的で、就寝1-2時間前からブルーライトを控えることで睡眠の質が向上します,まとめると、寝る前の時間は肌の修復力を最大化する準備時間ということです,入浴で血行を促進した後、保湿力の高い夜用クリームでケアし、適度な室温と湿度を保ちましょう。まずは毎晩同じ時間の丁寧な保湿ケアと1時間前のデジタルデトックスを習慣化することから始めてください,保存して今夜からの美肌習慣に活用してください。寝る前のひと手間で翌朝の肌が変わりますよ
19,どんな食べ物を食べると肌にいいの？,美肌食材っていっぱいありすぎて、結局何を食べればいいかわからない！,肌にいい食べ物を調べると、あれもこれもいいって書いてあって混乱しちゃいませんか？トマトにアボカド、鮭にナッツ...全部覚えきれないし、毎日意識するのも大変ですよね,皮膚の健康維持にはタンパク質（皮膚の構成要素）、ビタミンA（皮膚の分化促進）、ビタミンC（コラーゲン合成）、ビタミンE（抗酸化）、ビタミンB群（代謝促進）、亜鉛（創傷治癒）、必須脂肪酸（細胞膜の構成）が必要です。これらが不足すると肌のターンオーバーが乱れ、乾燥やトラブルの原因となります,特に重要なのはコラーゲンの材料となるタンパク質、その合成を助けるビタミンC、抗酸化作用のあるビタミンE、皮膚の新陳代謝を促すビタミンAです,つまり、特定の食材の大量摂取より、多様な食材のバランス良い摂取が美肌の秘訣ということです,1日350g以上の野菜摂取を目標に、色とりどりの野菜と果物を日々の食事に取り入れることから始めましょう。まずは毎食一品、色の濃い野菜を追加することを意識してみてください,保存して毎日の食事選びに活用してください。今日から色とりどりの食材で美肌を育てましょう
20,サプリと食べ物、どっちが効果的？,サプリ代に月1万円...でも本当にそれ必要ですか？,美肌のためにサプリをいくつも飲んでるけど、正直効果がよくわからない...そんなことありませんか？コラーゲン、ビタミンC、プラセンタ...気づいたら結構な出費になってて、これって本当に意味あるのかな？って思ったり,人体は食べ物から栄養素を摂取する仕組みに最適化されており、食品に含まれる栄養素は相互に作用し合って吸収効率が高まります。サプリメントは特定の栄養素を高濃度で効率的に摂取できる利点がありますが、医薬品ではなく食品扱いのため効果や安全性の基準が医薬品ほど厳格ではありません,食品からの栄養素は吸収率が良く他の栄養素との相互作用により効果が最大化されますが、現代の食生活では不足しがちな栄養素をサプリで補完するアプローチが実用的です,つまり、バランスの良い食事が基本で、サプリは補完的な役割ということです,まず1日3食のバランスの良い食事を基本とし、どうしても不足する栄養素（ビタミンCやオメガ3脂肪酸など）をサプリメントで補う方法をおすすめします。食事の代替ではなく、あくまでサポート役として使いましょう,保存してサプリとの上手な付き合い方に活用してください。食事とサプリで内側からの美肌ケアを始めましょう
21,食べ過ぎると逆効果になる食材はある？,「体にいいから」って食べ過ぎてませんか？実は美肌食材にも落とし穴があります,アボカド毎日1個、ナッツを袋ごと...美肌にいいって聞くと、ついつい食べ過ぎちゃうことありませんか？体にいいものなら多く摂った方がいいって思いがちですが、実はそれ、逆効果になる場合もあるんです,脂溶性ビタミン（A、D、E、K）は体内に蓄積されやすく過剰摂取により健康被害を起こす可能性があります。特にビタミンAの過剰摂取は皮膚の乾燥や落屑を引き起こすことがあります。また、高GI食品の過剰摂取は血糖値の急激な上昇を招き、皮脂分泌の増加やニキビの悪化につながる可能性があります,注意が必要なのは、ビタミンAを多く含むレバーやウナギ、高糖質の果物、ナッツ類、大豆製品などで、これらも適量であれば美容に有益な食材です,つまり、どんなに良い食材でも「適量」と「バランス」が美肌の鉄則ということです,多様な食材を適量ずつ摂取し、極端な食事制限や特定食材の大量摂取は避けることから始めましょう。一つの食材に偏らず、いろいろな食材を楽しみながら食べることが美肌への近道です,保存してバランスの良い食事の参考にしてください。何事もほどほどが美肌の秘訣ですよ
22,1日にどれくらい水を飲めばいい？,水2リットル、意地でも飲みきろうとしてトイレが近くなってませんか？,美肌のために頑張って2リットル水を飲んでるけど、頻尿になったり、お腹がタプタプしたり...体の小さい人も大きい人も一律2リットルって、なんだか変だと思いませんか？,成人の1日の水分出納は尿として約1.6L、呼吸や皮膚から約0.9L、合計約2.5Lが失われます。この失われた水分を補給するため、食事から約1L、体内で作られる水分約0.3Lを除いた約1.2-1.5Lを飲料として摂取する必要があります。体重1kgあたり約35-40mlが目安とされています,一般的に成人女性では1日1.5-2L程度が適切で、体重45kgの方なら約1.8L、60kgの方なら約2.4Lが目安となります,つまり、一律2リットルではなく自分の体重に合わせた適量があるということです,重要なのは一度に大量に飲むのではなく、こまめに分けて摂取することです。起床時、食事前、入浴前後などのタイミングでコップ一杯の水を飲む習慣をつけることから始めましょう,保存してご自身に合った水分摂取量の参考にしてください。無理のない範囲で水分補給を続けましょう
23,お茶やコーヒーも水分補給になる？,お茶5杯飲んだから水分摂取バッチリ？ちょっと待って、それカフェイン取りすぎかも,水は味がなくて苦手だけど、お茶やコーヒーなら美味しく飲めるからそれでOK...そう思ってカフェイン三昧の生活していませんか？実は肌のためには見直しが必要なんです,カフェインには軽度の利尿作用がありますが、日常的に摂取している人では耐性が形成され脱水効果は限定的です。お茶やコーヒーに含まれる水分は体内で水分として機能しますが、カフェインの過剰摂取は睡眠の質に影響を与え、間接的に肌に影響する可能性があります,お茶やコーヒーも水分補給に貢献しますが、カフェインの利尿作用により摂取した水分量よりもやや少ない分しか体内に保持されません,つまり、補助的な水分補給にはなるが、純粋な水の代替としては限界があるということです,美肌のための水分補給としては、全体の水分摂取量の半分以上は純粋な水から摂取することをおすすめします。朝起きたら白湯やお水をコップ一杯飲み、お茶やコーヒーは楽しみながら適度に摂取するバランスを心がけましょう,保存して水分補給のバランスを見直してみてください。純粋な水とカフェイン飲料の使い分けを始めましょう
24,冷たい水と常温水、どっちがいいの？,氷たっぷりの冷たい水、夏はサイコーだけど美肌的には...どうなんでしょう？,暑い日は冷蔵庫から出したキンキンに冷えた水を一気飲み！爽快で気持ちいいですよね。でも美肌を目指すなら、実はその飲み方、見直した方がいいかもしれません,冷たい飲み物は胃腸の血管を収縮させ消化機能を一時的に低下させる可能性があります。急激な体温変化は自律神経に影響を与え、血流や代謝にも影響する場合があります。常温の水は体温に近いため胃腸への負担が少なく、スムーズに吸収されやすいとされています,冷たい水は胃腸への負担が大きく血行や代謝の低下により間接的に肌に悪影響を与える可能性があり、常温水は体への負担が少なく効率的に水分補給ができます,つまり、美容と健康の観点では常温水が体に優しく効果的ということです,朝起きた直後は胃腸が敏感になっているため白湯（37-40℃程度）がより効果的です。まずは朝の水分補給を白湯や常温水に変えることから始め、日中も極端に冷たい飲み物を避けて体に優しい温度の水分摂取を心がけましょう,保存して体に優しい水分補給に活用してください。明日の朝から常温水習慣を始めてみましょう
25,生理前に肌荒れするのはなぜ？,毎月決まって生理前にニキビ...これってもう運命なんですか？,生理の1〜2週間前になると必ずと言っていいほど肌荒れして、せっかく調子よかったのにって落ち込んじゃいませんか？なんで毎月同じことが繰り返されるんでしょう...諦めるしかないのかな,女性ホルモンにはエストロゲン（美肌ホルモン）とプロゲステロン（黄体ホルモン）があります。エストロゲンは肌の状態を整えコラーゲン生成を促進しますが、プロゲステロンは皮脂分泌を増加させ肌のバリア機能を低下させます。生理前はプロゲステロンが優位になりエストロゲンが減少するため肌荒れが起こりやすくなります,プロゲステロンの増加により皮脂分泌が増え、同時にエストロゲンの減少により肌のバリア機能が低下するため、ニキビや乾燥などのトラブルが起こりやすくなります,まとめると、生理前の肌荒れはホルモンバランス変化による自然な現象ということです,この期間は肌が敏感になっているため刺激の少ないスキンケアを心がけましょう。生理前の2週間は、いつもより丁寧な保湿ケアと皮脂をコントロールする洗顔を行い、十分な睡眠とリラックスできる時間を確保することから始めてください,保存して生理前のスキンケアに活用してください。自然な変化と受け入れて優しくケアしましょう
26,PMSと肌の関係ってあるの？,イライラ、食欲爆発、肌荒れ...全部同時にくる地獄の生理前、偶然じゃないんです,生理前になると情緒不安定になって、チョコレートが無性に食べたくなって、さらに肌までボロボロ...心も体も肌も全部最悪で「なんで全部いっぺんに来るの？」って思いませんか？実はこれ全部つながってるんです,PMS（月経前症候群）は生理前のホルモン変動により起こる心身の不調で、エストロゲンとプロゲステロンの急激な変化が自律神経系に影響を与えます。これによりストレスホルモンであるコルチゾールの分泌が増加し、皮膚のバリア機能低下や炎症反応の促進が起こります,PMSによるストレスがストレスホルモンの分泌を増加させ、皮脂分泌の増加、血行不良、免疫機能の低下を引き起こし、肌荒れを悪化させます,つまり、PMS症状軽減が肌荒れの改善にもつながるということです,PMSの症状軽減が肌荒れ改善にもつながるため、生理前は特にストレス管理が重要です。まずは規則正しい生活リズム、適度な運動、リラックスできる時間の確保を心がけ、甘いものの摂取量をコントロールすることから始めましょう,保存してPMS期間の過ごし方に活用してください。心と体をいたわれば肌も自然と安定してきますよ
27,ホルモンバランスを整えるにはどうすればいい？,ホルモンバランスを整えるって、何から始めたらいいのか全然わからない！,肌荒れもPMSもどうにかしたくて「ホルモンバランスを整えよう」って思うけど、具体的に何したらいいの？高いサプリメント？特別な食事？結局何をしても変わらなくて途方に暮れてませんか？,ホルモンバランスは規則正しい生活リズム、適切な栄養摂取、十分な睡眠、適度な運動、ストレス管理によって維持されます。特に睡眠は成長ホルモンやメラトニンの分泌に重要で、不規則な睡眠はホルモンバランスを大きく乱します。また、過度なダイエットや栄養不足も女性ホルモンの分泌に悪影響を与えます,重要なのは毎日同じ時間に寝起きする規則正しい睡眠、バランスの取れた食事、適度な運動、ストレス管理の4つです,つまり、特別な方法ではなく基本的な生活習慣を整えることが最も効果的ということです,睡眠は7-8時間確保し、大豆製品、魚類、野菜を中心とした食事を心がけましょう。過度なダイエットは逆効果です。まずは就寝時間を一定にし、1日3食規則正しく食べることから始め、徐々にヨガや軽い散歩などの運動習慣を取り入れていきましょう,保存してホルモンバランス改善に活用してください。基本を大切に、無理のない範囲で始めましょう
28,運動するとどうして肌がきれいになるの？,運動習慣がある人って肌がきれいですよね。気のせいじゃなくて科学的な理由があるんです,ジム通いの友人とか、毎朝ランニングしてる人って、なんだか肌ツヤがいい気がしませんか？でも運動って汗でベタベタするし、逆に肌に悪そう...実際のところどうなんでしょう？,運動により心拍数が上がると血流が活発になり、肌の細胞に酸素と栄養がより効率的に運ばれるようになります。また、血行促進により老廃物の排出がスムーズになり、肌の新陳代謝が活性化されます。さらに運動は成長ホルモンの分泌を促進し、皮膚の修復・再生を助けます,血流改善により肌細胞への酸素と栄養の供給が増加し、同時に老廃物の排出も促進されることで、肌の新陳代謝が活発になり透明感やハリが向上します,つまり、運動による血行促進が肌の代謝を活性化させる科学的メカニズムがあるということです,過度な運動は逆効果となるため、週3-4回、30分程度の適度な運動が理想的です。まずは軽いウォーキングから始めて徐々に運動習慣を身につけましょう。運動後は汗をしっかりと洗い流し、保湿ケアを忘れずに行うことが重要です,保存して運動習慣作りに活用してください。今日から10分のお散歩で美肌への第一歩を踏み出しましょう
29,激しい運動じゃないと効果はない？,ジムでヘトヘトになるまで運動しないと美肌効果なし？そんなわけありません！,美肌のためには激しい運動じゃないとダメって思い込んで、結局疲れて続かない...そんな経験ありませんか？でも実はお散歩レベルでも十分効果があるって知ってましたか？,美肌効果を得るために必要なのは激しい運動ではなく継続的な血行促進です。軽度から中程度の運動でも十分に血流改善効果があり、むしろ激しすぎる運動は活性酸素を過剰に発生させ肌の老化を促進する可能性があります。また、過度な運動はストレスホルモンの分泌も増加させ肌に悪影響を与える場合があります,1日30分程度のウォーキングや軽いヨガでも血行促進、ストレス軽減、睡眠の質向上などの美容効果を十分に得ることができます,つまり、美肌のためには激しさより継続性が重要ということです,激しい運動は活性酸素の過剰発生でかえって肌の老化を促進するリスクがあります。継続しやすい強度の運動の方が長期的な美容効果を期待できます。まずは1日10-15分の軽い散歩から始めて、徐々に時間を延ばしていきましょう,保存して無理のない運動計画に活用してください。楽しく続けられる運動で美肌を手に入れましょう
30,汗はかいたほうが肌にいいの？,汗をかけばかくほど肌にいいと思っていませんか？実は汗そのものには美容効果はないんです,サウナや岩盤浴で汗をたくさんかいて、デトックス効果で肌がきれいになると信じている方、多いですよね。確かに汗をかいた後はなんとなく肌がすべすべした気がします。でも実はその効果は別のところにあるんです。この動画では、汗と美肌の関係を詳しく説明します,汗には体温調節の役割がありますが美容への直接的な効果については科学的根拠が限定的です。汗と一緒に老廃物が排出されるという説もありますが、実際には汗の主成分は水と塩分で、老廃物の排出は主に腎臓と肝臓が担っています。汗をかくことで血行が促進されることは確かですが、汗そのものに美容効果があるわけではありません,美肌効果があるのは汗ではなく汗をかくに至った血行促進で、運動や入浴で血流が改善されることで肌の代謝が活発になります,つまり、汗自体に美容効果はなく、血行促進による代謝アップが美肌につながるということです,汗をかいた後は雑菌の繁殖や毛穴詰まりを防ぐため適切な洗浄と保湿が必要です。汗をかくことを目的とするよりも、適度な運動で血行を促進し、汗をかいた後は清潔にして保湿することを重視しましょう,保存して運動後のケアに活用してください。汗後の丁寧なケアで美肌を維持しましょう
31,夜更かしすると肌が荒れるのはなぜ？,夜更かしした翌日の肌荒れは単なる疲れではないって知っていましたか？成長ホルモン不足による肌修復の問題なんです,仕事や勉強で夜遅くまで起きていて、翌朝鏡を見てがっかりした経験、ありますよね。化粧ノリも悪いし、なんだかくすんで見える。やっぱり睡眠不足は肌に悪いんだなと感じます。この動画では、夜更かしと肌荒れのメカニズムを詳しく解説します,夜更かしにより睡眠時間が短くなると成長ホルモンの分泌が不足します。成長ホルモンは睡眠中、特に入眠後の深いノンレム睡眠時に最も多く分泌され皮膚の細胞分裂と修復を促進します。また、夜最重要更かしはストレスホルモンであるコルチゾールの分泌を増加させ、皮膚のバリア機能低下や炎症反応の促進を引き起こします,本来睡眠中に行われる肌の修復・再生プロセスが不十分になり、古い角質の蓄積、毛穴詰まり、くすみなどが生じやすくなります,まとめると、夜更かしは肌の自然な修復サイクルを妨げ、トラブルを引き起こすということです,美肌のためには毎日同じ時間に就寝し、7-8時間の質の良い睡眠を確保することが重要です。まずは就寝時間を30分早めることから始め、就寝前1時間はスマートフォンやテレビを控えてリラックスできる環境を整えましょう,保存して早寝習慣作りに活用してください。今夜から30分早く寝て肌の修復時間を確保しましょう
32,甘いものがニキビの原因になるの？,甘いものとニキビに関係があるなんて迷信だと思っていませんか？実は科学的な根拠があるんです,チョコレートやケーキを食べた翌日にニキビができて、でも本当に関係あるのかな？と疑問に思う方、多いですよね。たまたまかもしれないし、ストレスのせいかもしれない。でも実は明確なメカニズムがあるんです。この動画では、その科学的根拠をお話しします,高糖質食品を摂取すると血糖値が急激に上昇し、それに対応してインスリンが大量に分泌されます。インスリンは皮脂腺を刺激して皮脂分泌を増加させ、同時に毛穴周囲の角化を促進するため毛穴詰まりとニキビの原因となります。また、糖質の過剰摂取は炎症反応を促進し既存のニキビを悪化させる可能性もあります,糖質の多い食品は血糖値を急激に上昇させインスリンの大量分泌により皮脂分泌が増加し、毛穴詰まりとニキビの原因となります,つまり、甘いものとニキビには確実に科学的な因果関係があるということです,糖質を完全に避ける必要はなく、量と質を意識することが重要です。白砂糖や精製された糖質を控え、果物や全粒穀物など低GI食品を選びましょう。まずは1日の砂糖摂取量を意識し、清涼飲料水やお菓子の量を徐々に減らすことから始めてください,保存して糖質コントロールの参考にしてください。甘いものとの上手な付き合い方でニキビ知らずの肌を目指しましょう
33,ストレスは肌にどう影響するの？,ストレスが肌に与える影響って想像以上に深刻って知っていましたか？多方面から肌にダメージを与えるんです,仕事や人間関係でストレスを感じると、肌の調子まで悪くなってしまう方、多いですよね。心と肌って関係ないように思えるのに、なぜかストレスが溜まると肌荒れしてしまう。この動画では、ストレスと肌の密接な関係を詳しく解説します,ストレスを受けると視床下部-下垂体-副腎皮質系が活性化され、ストレスホルモンであるコルチゾールが分泌されます。コルチゾールは皮脂分泌を増加させ皮膚のバリア機能を低下させコラーゲンの生成を阻害します。また、ストレスは免疫機能を低下させるため肌の自然な修復能力も損なわれ、ストレスによる血管収縮は血行不良を引き起こし肌への栄養供給を妨げます,コルチゾール分泌による皮脂分泌増加、バリア機能低下、コラーゲン生成阻害により、ニキビ、乾燥、シワ、くすみなど様々な肌トラブルが生じやすくなります,つまり、ストレスは肌に多方面から悪影響を与える美肌の大敵ということです,ストレス管理は美肌にとって不可欠で、適度な運動、十分な睡眠、リラクゼーション、趣味の時間などでストレスを軽減することが重要です。まずは1日10分間でも深呼吸やストレッチなど、リラックスできる時間を作ることから始めましょう,保存してストレスケアに活用してください。心を整えれば肌も自然と美しくなりますよ
